<?xml version="1.0" encoding="UTF-8"?>
<material:material timestamp="2001-12-31T12:00:00" xmlns:common="http://video-metadata.tv.se/common/v1" xmlns:material="http://video-metadata.tv.se/material/v1" xmlns:xsi="http://www.w3.org/2001/XMLSchema-instance" xsi:schemaLocation="http://video-metadata.tv.se/material/v1 ../xsd/material.xsd ">
  <providerId>providerId</providerId>
  <id>1234567890</id>
  <distributor>se.tv4</distributor>
  <priceGroup>Premium</priceGroup>
  <contentIdRef>contentIdRef</contentIdRef>
  <materialType>program</materialType>
  <videoFormat threeD="true">576i</videoFormat>
  <audioList>
    <format language="EN">mono</format>
  </audioList>
  <aspectRatio>4:3</aspectRatio>
  <subtitleList>
    <subtitle format="closed" language="EN">subtitle</subtitle>
  </subtitleList>
  <accessibilityList>
    <accessibilityList format="hearingImpairedSubtitle" language="EN">accessibilityList</accessibilityList>
  </accessibilityList>
  <materialReferenceList>
    <reference bitrate="" duration="" type="video">reference</reference>
  </materialReferenceList>
  <rightsList>
    <rights>
      <rightsName>rightsName</rightsName>
      <validFrom>2001-12-31T12:00:00</validFrom>
      <validTo>2001-12-31T12:00:00</validTo>
      <unlimitedPeriod>true</unlimitedPeriod>
      <rightsCategoryList>
        <rightsCategory>
          <vod xsi:type="material:deviceTypeRights">
            <deviceType>web</deviceType>
          </vod>
          <ppv xsi:type="material:deviceTypeRights">
            <deviceType>web</deviceType>
          </ppv>
          <timeshift>
            <catchUpRights>
              <fastForward>true</fastForward>
              <rewind>true</rewind>
              <pause>true</pause>
            </catchUpRights>
            <startOverRights>
              <fastForward>true</fastForward>
              <rewind>true</rewind>
              <pause>true</pause>
            </startOverRights>
          </timeshift>
          <noTransmission>
            <deviceType>web</deviceType>
          </noTransmission>
          <addProviderLogo>true</addProviderLogo>
          <allowAds>true</allowAds>
          <drmRestrictions/>
          <geoRestrictions/>
          <shareToList>
            <shareTo>shareTo</shareTo>
          </shareToList>
        </rightsCategory>
      </rightsCategoryList>
    </rights>
  </rightsList>
</material:material>
